"PUBMed ID","rs# or other ID","Gene symbol","Hg18 Chromosome","Hg19 Chromosome","Hg18 Genomic Coordinate of SNP","Hg19 Genomic Coordinate of SNP","Hg18 Genomic Region","Hg19 Genomic Region","Hg18 Distance from TSS","Hg19 Distance from TSS","Mutation","P-value(s)","Q-value(s)","Authors","Year","Type of Study","Journal","Ethnicity/Race","Sample Type","Number of Women with PE (after filtering, actually in study)","PE Women Details","Number of offspring from PE mothers","Number of Controls (actually in study)","Control Women Details","Number of offspring from control mothers","Initial Inclusion Criteria for Cases (have all details)","Controls Inclusion/Exclusion Criteria","PE % Primigravidae","Controls % Primigravidae","PE Phenotype Exclusion Criteria","PE Maternal Age (years)","Controls Maternal Age (years)","PE Maternal weight (kg)","Controls Maternal weight (kg)","PE Maternal height (cm)","Controls Maternal height (cm)","PE Maternal BMI (kg/m^2)","Controls Maternal BMI (kg/m^2)","PE Offspring birth weight (g)","Control Offspring birth weight (g)","PE Gestational Age (weeks)","Controls Gestational Age (weeks)","Proteinuria Definition","Systolic blood pressure >= ? mm Hg (e.g. 140)","Diastolic blood pressure >= ? mm Hg (e.g. 90)","Additional PE Criteria"
"8513325","rs699","AGT","1","1","228912416","230845793","coding","coding","4543","4543","M268*T* (M235*T*)","_","_","Ward K et al. (Tomoda S)","1993","Candidate gene approach","Nature Genetics","Caucasian, Japanese","maternal blood","63","45 (32 primigravidae) Caucasian; 18 (13 primigravidae) Japanese","_","651","571 Caucasian, 80 Japanese","_","Pregnancy-induced hypertension cases with singleton pregnancies delivered at greater than 20 weeks (Caucasians).   ","Exclusion: Offspring < 2,500 grams; diastolic blood pressure > 85; systolic blood pressure > 140; CHT; renal disease; Same as exclusion in cases for Japanese, patients with premature deliveries","71","_","HT, CHT, HELLP; HT, diabetic nephropathy, other renal disease (Japanese)","_","_","_","_","_","_","_","_","_","_","_","_","Standard definition from American College of Obstetrics and Gynecology, Technical Bulletin, 91 (1986)","140","85","Standard definition from American College of Obstetrics and Gynecology, Technical Bulletin, 91 (1986)"
"9192280","rs1801133","MTHFR","1","1","11778964","11856377","coding","coding","9738","9783","C/*T*","<0.004 genotype, <0.02 allele","_","Sohda S et al. (Kubo T)","1997","Candidate gene approach","Journal of Medical Genetics","Japanese, Asian","_","67","_","_","98","98 normal pregnant women, 260 healthy adults","_","_","_","_","_","_","31.0 +/- 5.3","30.6 +/- 4.3","_","_","_","_","_","_","_","_","_","_","_","_","_","_"
"9241730","rs1801133 ","MTHFR","1","1","11778964","11856377","coding","coding","9738","11685","C/*T*","_","_","Grandone E et al. (Di Minno G)","1997","Candidate gene approach","Journal of Thrombosis and Haemostasis","_","_","96","_","_","129","_","_","_","_","_","0","_","_","_","_","_","_","_","_","_","_","_","_","_","_","_","_","_"
"9241730","rs6025","F5","1","1","167785672","169519048","coding","coding","36721","36721","G/*A*","_","_","Grandone E et al. (Di Minno G)","1997","Candidate gene approach","Journal of Thrombosis and Haemostasis","_","_","96","_","_","129","_","_","_","_","_","0","_","_","_","_","_","_","_","_","_","_","_","_","_","_","_","_","_"
"9616877","rs1800629","TNF","6","6","31651009","31543030","upstream","upstream","-319","-319","G/A","NS","_","Dizon-Townson DS et al. (Ward K)","1998","Candidate gene approach","Journal of Reproductive Immunology","Caucasian 94%, Hispanic 3%, Asian 2%, Black <1%, Native American <1%","_","131","Severe PE","_","41","_","_","Included only severe PE","Inclusion: normotensive gravidas.  No patients were specifically excluded or included  based on age, race, medical history, or obstetric history","_","_","HT, renal disease, insulin-dependent diabetes","25 (min, max : 15,39)","_","_","_","_","_","_","_","_","_","33 (min, max : 21,42)","_",">= 500 mg in 24 hrs or 3+ -4+","140","90","(1) a systolic blood pressure of 160 mmHg or greater, or a diastolic blood pressure of 110 mmHg or greater on two occasions at least 6 h apart, (2) proteinuria of at least 5 g in a 24-h period (or 3 - 4 based on semiquantitative analysis), (3) oliguria, a 24-h urinary output of less than 400-500 ml, (4) cerebral or visual disturbances, (5) pulmonary edema or cyanosis, (6) epigastric or right upper quadrant pain, (7) impaired liver function of unclear etiology, and:or (8) thrombocytopenia."
"10329869","rs6025","F5","1","1","167785672","169519048","coding","coding","36721","36721","G/*A*","_","_","van Pampus MG et al. (Buller HR)","1999","Candidate gene approach","American Journal of Obstetrics and Gynecology","Caucasian, Dutch","_","345","158 severe PE, 164 HELLP, 23 history of eclampsia","_","67","_","_","Included only severe PE or HELLP"," healthy, fertile women with normal menstrual cycles, not taking oral contraceptives, who had completed their pregnancies uneventfully. All women with ahistory of any perinatal complications, such as preterm labor, fetal death, or miscarriage, were excluded.","81","44","HT, renal disease, vascular disease, diabetes","_","20-40","_","_","_","_","_","_","_","_","<36","_","urinary protein concentration >= 0.5 g/L","140","110","_"
"10373212","rs1801133 ","MTHFR","1","1","11778964","11856377","coding","coding","9738","11685","C/T","NS","_","O'Shaughnessy KM et al. (Morris NH)","1999","Candidate gene approach","Hypertension","Caucasian, Northern European, British, East Anglian","maternal blood sample","283","230 primagravidae, 149 had severe PE, 25 developed HELLP","_","200","Caucasian northern europian","_","Proteinuric and hypertensive occurring after 20 weeks of gestation with at least a 25-mm Hg rise in diastolic blood pressure. Conditions were resolved by 3 months postpartum.","Normotensive women with no history of preeclampsia and <50 years old at screening","81.3","_","No participants had a multiple-birth pregnancy, concurrent diabetes, renal disease, or essential hypertension","_","_","_","_","_","_","_","_","_","_","_","_",">300 mg/24 hours or at least ++ of proteinuria on a dip stick","140","90","_"
"10373212","rs6025","F5","1","1","167785672","169519048","coding","coding","36721","36721","G/A","NS","_","O'Shaughnessy KM et al. (Morris NH)","1999","Candidate gene approach","Hypertension","Caucasian, Northern European, British, East Anglian","maternal blood sample","283","230 primagravidae, 149 had severe PE, 25 developed HELLP","_","200","Caucasian northern europian","_","Proteinuric and hypertensive occurring after 20 weeks of gestation with at least a 25-mm Hg rise in diastolic blood pressure. Conditions were resolved by 3 months postpartum.","Normotensive women with no history of preeclampsia and <50 years old at screening","81.3","_","No participants had a multiple-birth pregnancy, concurrent diabetes, renal disease, or essential hypertension","_","_","_","_","_","_","_","_","_","_","_","_",">300 mg/24 hours or at least ++ of proteinuria on a dip stick","140","90","_"
"10521764","rs1799963","F2","11","11","46717630","46761054","3'UTR","3'UTR","20312","20312","G/A","NS","_","De Groot CJ et al. (Rosendaal FR.Source)","1999","Candidate gene approach","American Journal of Obstetrics and Gynecology","Caucasian ","_","163","Caucasian 96%","_","163","Caucasian 96%","_"," rise of blood pressure in pregnancy, late-pregnancy hypertension, proteinuria ","Inclusion: first pregnancy, no rise in blood pressure, no hypertension or proteinuria, similar age (+/-5 years), no biologic relationship, and a delivery date as close as possible to the delivery date of a patient. Exclusion: same as patient","100","100","Multigravidae, CHT, renal disease, diabetes, collagen vascular diseases, cancer, or thrombosis ","28","28","_","_","_","_","_","_","_","_","34.6","39.4",">= 2+ [100 mg/dL] on a voided specimen or >= 1+ [30 mg/dL] on a catheterized specimen; 30-100 mg/dL vs <30 for controls","140","90","Rise in blood pressure (>= 30 mm Hg systolic or >= 20 mm Hg diastolic over first 20 weeks)"
"10521764","rs6025","F5","1","1","167785672","169519048","coding","coding","36721","36721","G/A","NS","_","De Groot CJ et al. (Rosendaal FR.Source)","1999","Candidate gene approach","American Journal of Obstetrics and Gynecology","Caucasian ","_","163","Caucasian 96%","_","163","Caucasian 96%","_"," rise of blood pressure in pregnancy, late-pregnancy hypertension, proteinuria ","Inclusion: first pregnancy, no rise in blood pressure, no hypertension or proteinuria, similar age (+/-5 years), no biologic relationship, and a delivery date as close as possible to the delivery date of a patient. Exclusion: same as patient","100","100","Multigravidae, CHT, renal disease, diabetes, collagen vascular diseases, cancer, or thrombosis ","28","28","_","_","_","_","_","_","_","_","34.6","39.4",">= 2+ [100 mg/dL] on a voided specimen or >= 1+ [30 mg/dL] on a catheterized specimen; 30-100 mg/dL vs <30 for controls","140","90","Rise in blood pressure (>= 30 mm Hg systolic or >= 20 mm Hg diastolic over first 20 weeks)"
"10549971","rs1801133","MTHFR","1","1","11778964","11856377","coding","coding","9738","9783","C/T","0.27 CC, 0.36 CT, 0.49 TT, 0.16 C, 0.28 T","_","Chikosi AB et al. (Rom L)","1999","Candidate gene approach","British Journal of Obstetrics and Gynaecology","South African, Black","_","105","_","_","110","_","_","Re-eclampsia was defined as a blood pressure of > 140/90 mmHg on two separateoccasions six hours apart and at least 300 mg/day of proteinuria in the second half of pregnancy. Only indigenous Zulu women were included in the study.","Women with a history of hypertension in a previous pregnancy were excludedfrom the control group","43","49","Women with known endocrine or metabolic disorders and those with known non-indigenous, non-Zulu relatives were excluded from the study","_","_","_","_","_","_","_","_","_","_","_","_","at least 300 mg/day of pro-teinuria in the second half of pregnancy","140","90","_"
"10636447","rs1801177","LPL","8","8","19849987","19805707","coding","coding","9126","9126","D36*N* (D9*N*)","0.02","_","Hubel CA et al. (Ferrell RE)","1999","Candidate gene approach","Clinical Genetics","Caucasian","maternal blood sample","100","_","_","211","_","_","Inclusion: hypertension, proteinuria, and hyperuricemia, and reversal of hypertension and proteinuria after delivery","Inclusion:normotensive","","","","","","","","","","","","","","","","","","",""
"10636447","rs268","LPL","8","8","19857808","19813528","coding","coding","16947","16947","N318*S* (N291*S*)","0.008","_","Hubel CA et al. (Ferrell RE)","1999","Candidate gene approach","Clinical Genetics","Caucasian","maternal blood sample","100","_","_","211","_","_","Inclusion: hypertension, proteinuria, and hyperuricemia, and reversal of hypertension and proteinuria after delivery","Inclusion:normotensive","","","","","","","","","","","","","","","","","","",""
"10655155","rs1801133 ","MTHFR","1","1","11778964","11856377","coding","coding","9738","11685","C/T","_","_","Rajkovic A et al. (Williams MA)","2000","Candidate gene approach","Molecular Genetics and Metabolism","African, Zimbabwean","_","171","138 PE, 33 eclampsia","_","185","_","_","Inclusion: PE or eclampsia","Exclusion: Pregnancy-induced HT","_","_","_","17 (<19), 132 (19-34), 23 (>=35)","28 (<19), 146 (19-34), 11 (>=35)","_","_","_","_","27.1 +/- 4.4","25.3 +/- 3.8","_","_","36.3 +/- 2.9","38.5 +/- 3.2","urine protein concentration of 0.1 g/L or more ","140","90","Sustained 15 mm Hg diastolic rise or a 30 mm Hg rise in systolic blood pressure.  If first trimester blood pressures were unknown 6h or more blood pressure of 140/90 mmHg.  Proteinuria concentration was in 2 random specimens collected at least 4 hours apart. "
"10694185","rs41271499 ","AGT","1","1","228913092","230846469","coding","coding","3867","3867","L43F (L10F)","NS","_","Curnow KM et al. (August P)","2000","Candidate gene approach","Journal of Hypertension","Caucasian, Black, Asian, Chinese, Egyptian, Hispanic, Filipino","maternal blood","32","6 HELLP, Caucasian >50%, Black 33%, 2 Asian, Chinese, 1 Egyptian, 1 Hispanic, 1 Filipino","_","_","_","_","HELLP or at least one feature of severe PE required, diastolic pressure < 80 mmHg before 20 weeks","_","100","_","HT or vascular condition (essential hypertension, secondary hypertension, diabetes, renal disease)","_","_","_","_","_","_","_","_","_","_","_","_","> 300 mg/24 h in the absence of urinary tract infection. Serum uric acid levels were > 6 mg/dl.","140","90, 110 (severe)","Pre-eclampsia was defined as the development of a persistent elevation "
"10694185","rs699","AGT","1","1","228912416","230845793","coding","coding","4543","4543","M268T (M235T)","NS","_","Curnow KM et al. (August P)","2000","Candidate gene approach","Journal of Hypertension","Caucasian, Black, Asian, Chinese, Egyptian, Hispanic, Filipino","maternal blood","32","6 HELLP, Caucasian >50%, Black 33%, 2 Asian, Chinese, 1 Egyptian, 1 Hispanic, 1 Filipino","_","_","_","_","HELLP or at least one feature of severe PE required, diastolic pressure < 80 mmHg before 20 weeks","_","100","_","HT or vascular condition (essential hypertension, secondary hypertension, diabetes, renal disease)","_","_","_","_","_","_","_","_","_","_","_","_","> 300 mg/24 h in the absence of urinary tract infection. Serum uric acid levels were > 6 mg/dl.","140","90, 110 (severe)","Pre-eclampsia was defined as the development of a persistent elevation "
"10862840","rs1799963","F2","11","11","46717630","46761054","3'UTR","3'UTR","20312","20312","G/*A*","_","_","Kupferminc MJ et al. (Lessing JB)","2000","Candidate gene approach","Obstetrics and Gynecology","Israeli, Caucasian, Ashkenazi","_","63","25 Ashkenazi, 38 non-Ashkenazi","_","126","50 Ashkenazi, 76 non-ashkenazi; 68 primiparous","_","Severe PE required; HELLP and eclampsia not excluded","No history of thromboembolic event; each PE case matched with two appropriate control women ( +/- 2 yrs in age) ","86","54","Thromboembolic event history","_","_","_","_","_","_","_","_","1463 +/- 632","3411 +/- 414","32 +/- 4.0","39.5 +/- 1.4","> 5 g/24 hours","160","110","platelet count less than 100,000/mm^3, presence of hemolysis, elevated liver enzymes (ie, serum aminotransferase concentrations), and low platelets"
"10862840","rs1801133 ","MTHFR","1","1","11778964","11856377","coding","coding","9738","11685","C/*T*","0.008","_","Kupferminc MJ et al. (Lessing JB)","2000","Candidate gene approach","Obstetrics and Gynecology","Israeli, Caucasian, Ashkenazi","_","63","25 Ashkenazi, 38 non-Ashkenazi","_","126","50 Ashkenazi, 76 non-ashkenazi; 68 primiparous","_","Severe PE required; HELLP and eclampsia not excluded","No history of thromboembolic event; each PE case matched with two appropriate control women ( +/- 2 yrs in age) ","86","54","Thromboembolic event history","_","_","_","_","_","_","_","_","1463 +/- 632","3411 +/- 414","32 +/- 4.0","39.5 +/- 1.4","> 5 g/24 hours","160","110","platelet count less than 100,000/mm^3, presence of hemolysis, elevated liver enzymes (ie, serum aminotransferase concentrations), and low platelets"
"10862840","rs6025","F5","1","1","167785672","169519048","coding","coding","36721","36721","G/*A*","0.001","_","Kupferminc MJ et al. (Lessing JB)","2000","Candidate gene approach","Obstetrics and Gynecology","Israeli, Caucasian, Ashkenazi","_","63","25 Ashkenazi, 38 non-Ashkenazi","_","126","50 Ashkenazi, 76 non-ashkenazi; 68 primiparous","_","Severe PE required; HELLP and eclampsia not excluded","No history of thromboembolic event; each PE case matched with two appropriate control women ( +/- 2 yrs in age) ","86","54","Thromboembolic event history","_","_","_","_","_","_","_","_","1463 +/- 632","3411 +/- 414","32 +/- 4.0","39.5 +/- 1.4","> 5 g/24 hours","160","110","platelet count less than 100,000/mm^3, presence of hemolysis, elevated liver enzymes (ie, serum aminotransferase concentrations), and low platelets"
"10965192","rs1801131","MTHFR","1","1","11777062","11854475","coding","coding","11640","11685","A/C","NS","_","Kaiser T et al. (Moses EK)","2000","Candidate gene approach","Gynecologic and Obstetric Investigation (Human Heredity)","Caucasian, British, Anglo-Saxon,1 Maltese, 2 Italian","maternal blood","147","114 PE, 33 eclampsia","_","109","_","_","Severe PE definition here is normal PE elsewhere. PE features in first and not subsequent pregnancies","_","100","_","_","_","_","_","_","_","_","_","_","_","_","_","_","10.3 g/l in a 24-hour specimen, or at least 2+ dipstick proteinuria on a random urine collection","140","90","Severe PE : 1)A rise from baseline systolic blood pressure of at least 25 mm Hg and/or a rise from baseline diastolic pressure of at least 15 mm Hg.  or 2) systolic pressure >=140mm Hg and/or diastolic pressure >=90mm HG on at least 2 occasions 6 h or more apart"
"11096266","rs1801133 ","MTHFR","1","1","11778964","11856377","coding","coding","9738","11685","C/T","NS","_","Kaiser T et al. (Moses EK)","2001","Candidate gene approach","Gynecologic and Obstetric Investigation (Human Heredity)","Caucasian, British, Anglo-Saxon,1 Maltese, 2 Italian","_","147","114 PE, 33 eclampsia","_","109","_","_","Severe PE definition here is normal PE elsewhere. PE features in first and not subsequent pregnancies","_","100","_","_","_","_","_","_","_","_","_","_","_","_","_","_","10.3 g/l in a 24-hour specimen, or at least 2+ dipstick proteinuria on a random urine collection","140","90","Severe PE : 1)A rise from baseline systolic blood pressure of at least 25 mm Hg and/or a rise from baseline diastolic pressure of at least 15 mm Hg.  or 2) systolic pressure >=140mm Hg and/or diastolic pressure >=90mm HG on at least 2 occasions 6 h or more apart"
"11283205","rs1051740","EPHX1","1","1","224086255","226019632","coding","coding","6657","21836","Y113H","NS","_","Zusterzeel PL et al. (Steegers EA)","2001","Candidate gene approach","Journal of Medical Genetics","Dutch, Caucasian","maternal blood","181","96 HELLP, 87 without HELLP; 67 primiparous HELLP, 83 primiparous without HELLP","_","151","_","_","_","Exclusion: pregnant; diabetes or renal, hepatic, haematological, pre-existing hypertensive, or cardiovascular disease who had experienced normal normotensive pregnancies only (median number of pregnancies 2, range 1 to 4)","79","86","_","28 (19-40) (HELLP); 28 (19-39) (without HELLP); median values","30 (18-42) median","_","_","_","_","_","_","_","_","31 +/- 5","_","> 0.3 g/l in a 24 hour urine collection period","_","110","occurrence after 20 weeks gestation of a diastolic blood pressure greater than 90 mm Hg on two or more occasions at least four hours apart with proteinuria "
"11283205","rs2234922","EPHX1","1","1","224093028","226026405","coding","coding","13430","28609","H139R ","NS","_","Zusterzeel PL et al. (Steegers EA)","2001","Candidate gene approach","Journal of Medical Genetics","Dutch, Caucasian","maternal blood","181","96 HELLP, 87 without HELLP; 67 primiparous HELLP, 83 primiparous without HELLP","_","151","_","_","_","Exclusion: pregnant; diabetes or renal, hepatic, haematological, pre-existing hypertensive, or cardiovascular disease who had experienced normal normotensive pregnancies only (median number of pregnancies 2, range 1 to 4)","79","86","_","28 (19-40) (HELLP); 28 (19-39) (without HELLP); median values","30 (18-42) median","_","_","_","_","_","_","_","_","31 +/- 5","_","> 0.3 g/l in a 24 hour urine collection period","_","110","occurrence after 20 weeks gestation of a diastolic blood pressure greater than 90 mm Hg on two or more occasions at least four hours apart with proteinuria "
"11339912","rs16944","IL1B","2","2","113311337","113594866","upstream","upstream","-510","-510","C/T","NS","_","Hefler LA et al. (Gregg AR)","2001","Candidate gene approach","Obstetrics and Gynecology","Hispanic","maternal blood","69","_","_","47","_","_","_","Inclusion: Gravida >= 2 (normal pregnancy), one previous term delivery, no history of PE; Exclusion: essential HT, chronic renal disease, diabetes, platelet disorders, autoimmune conditions","_","0","Womean who had preotein uria and hypertension before 20 weeks gestation, or women with other medical conditions that could cause proteinuria and hypertension","24 (21-30) median (range)","25 (23-29.7) median (range)","_","_","_","_","_","_","_","_","37.1 (35.1-39.42)","39.8 (38.7-40.4)","one 24-hour urine collection with a total protein excretion of at least .3 g","_","_","Blood pressure was considered elevated when systolic BP was at least "
"11349190","rs1801133 ","MTHFR","1","1","11778964","11856377","coding","coding","9738","11685","C/T","NS","_","Kim YJ et al. (Merrill DC)","2001","Candidate gene approach","American Journal of Obstetrics and Gynecology","Caucasian","maternal blood or cheeck swab","281","193 severe PE, 21 HELLP","_","360","_","_","Mild or severe PE","Inclusion: >= 2 term pregnancies unaffected by PE, no family history of PE, no CHT","_","0","_","_","_","_","_","_","_","_","_","_","_","_","_","1+ reading on dipstick or > 300 mg/24-h urine sample; >5 g protein detected in a 24-hour period or a 4+ reading on dipstick (severe)","140, 160 (severe)","90, 110 (severe)","Severe PE met criteria of one or more of (1) diastolic bp or systolic bp, (2) proteinuria, (3) thrombocytopenia, with <100,000 platelets/mL; (4) oliguria, with <400 mL urine produced in 24 hours; (5) pulmonary edema; and (6) elevated aspartate aminotransferase or alanine aminotransferase activity; HELLP considered thrombocytopenia "
"11349190","rs6025","F5","1","1","167785672","169519048","coding","coding","36721","36721","G/A","NS","_","Kim YJ et al. (Merrill DC)","2001","Candidate gene approach","American Journal of Obstetrics and Gynecology","Caucasian","maternal blood or cheeck swab","281","193 severe PE, 21 HELLP","_","360","_","_","Mild or severe PE","Inclusion: >= 2 term pregnancies unaffected by PE, no family history of PE, no CHT","_","0","_","_","_","_","_","_","_","_","_","_","_","_","_","1+ reading on dipstick or > 300 mg/24-h urine sample; >5 g protein detected in a 24-hour period or a 4+ reading on dipstick (severe)","140, 160 (severe)","90, 110 (severe)","Severe PE met criteria of one or more of (1) diastolic bp or systolic bp, (2) proteinuria, (3) thrombocytopenia, with <100,000 platelets/mL; (4) oliguria, with <400 mL urine produced in 24 hours; (5) pulmonary edema; and (6) elevated aspartate aminotransferase or alanine aminotransferase activity; HELLP considered thrombocytopenia "
"11483920","rs1799963","F2","11","11","46717630","46761054","3'UTR","3'UTR","20312","20312","G/A","NS","_","Livingston JC et al. (Sibai BM)","2001","Candidate gene approach","American Journal of Obstetrics and Gynecology","Caucasian, Black","_","110","12 eclampsia, 21 HELLP, 104 proteinuria; 63 Black, 47 Caucasian","92","97","62 Black, 35 caucasian","_","Severe PE required (which included eclampsia and HELLP)","Excluded: history of PE","_","_","CHT, diabetes mellitus, preexisting renal disease, history of thromboembolism, multifetal gestation, or major fetal congenital anomaly.","24.5 +/- 7.7","24.4 +/- 6.2","_","_","_","_","_","_","_","_","34.3 +/- 5.1","35.6 +/- 4.8","> 300 mg in a 24-hour urine collection","160","110","Severe preeclampsia was defined as severe hypertension (systolic blood pressure >=160 mm Hg or diastolic blood pressure >=110 mm Hg) in the presence of proteinuria (n = 104)"
"11483920","rs1801133 ","MTHFR","1","1","11778964","11856377","coding","coding","9738","11685","C/T","NS","_","Livingston JC et al. (Sibai BM)","2001","Candidate gene approach","American Journal of Obstetrics and Gynecology","Caucasian, Black","_","110","12 eclampsia, 21 HELLP, 104 proteinuria; 63 Black, 47 Caucasian","92","97","62 Black, 35 caucasian","_","Severe PE required (which included eclampsia and HELLP)","Excluded: history of PE","_","_","CHT, diabetes mellitus, preexisting renal disease, history of thromboembolism, multifetal gestation, or major fetal congenital anomaly.","24.5 +/- 7.7","24.4 +/- 6.2","_","_","_","_","_","_","_","_","34.3 +/- 5.1","35.6 +/- 4.8","> 300 mg in a 24-hour urine collection","160","110","Severe preeclampsia was defined as severe hypertension (systolic blood pressure >=160 mm Hg or diastolic blood pressure >=110 mm Hg) in the presence of proteinuria (n = 104)"
"11483920","rs6025","F5","1","1","167785672","169519048","coding","coding","36721","36721","G/A","NS","_","Livingston JC et al. (Sibai BM)","2001","Candidate gene approach","American Journal of Obstetrics and Gynecology","Caucasian, Black","_","110","12 eclampsia, 21 HELLP, 104 proteinuria; 63 Black, 47 Caucasian","92","97","62 Black, 35 caucasian","_","Severe PE required (which included eclampsia and HELLP)","Excluded: history of PE","_","_","CHT, diabetes mellitus, preexisting renal disease, history of thromboembolism, multifetal gestation, or major fetal congenital anomaly.","24.5 +/- 7.7","24.4 +/- 6.2","_","_","_","_","_","_","_","_","34.3 +/- 5.1","35.6 +/- 4.8","> 300 mg in a 24-hour urine collection","160","110","Severe preeclampsia was defined as severe hypertension (systolic blood pressure >=160 mm Hg or diastolic blood pressure >=110 mm Hg) in the presence of proteinuria (n = 104)"
"11531629","rs1801133 ","MTHFR","1","1","11778964","11856377","coding","coding","9738","11685","C/T","NS","_","Lauszus FF et al. (Klebe JG)","2001","Candidate gene approach","Acta Obstetricia et Gynecologica Scandinavica","Caucasian, Northern European","peripheral blood leukocytes","46","46 of 233 studied (all with diabetes) developed PE","_","_","_","_","Insulin-dependent diabetes mellitus","_","_","_","_","_","_","_","_","_","_","_","_","_","_","_","_","> 300 mg in previously normo- and microalbuminuric women","_","90","In macroalbuminuricwomen preeclampsia was diagnosed when albuminexcretion and uric acid increased significantly(three- and twofold, respectively"
